--
-- Test basic select, insert, delete, update operations
--
\c lsmtest
CREATE FOREIGN TABLE test(key TEXT, value TEXT) SERVER lsm_server;  
INSERT INTO test VALUES('YC', 'VidarDB');  
SELECT * FROM test;  
 key |  value  
-----+---------
 YC  | VidarDB
(1 row)

INSERT INTO test VALUES('California', 'Waterloo');  
SELECT * FROM test;  
    key     |  value   
------------+----------
 YC         | VidarDB
 California | Waterloo
(2 rows)

DELETE FROM test WHERE key='California';  
SELECT * FROM test;  
 key |  value  
-----+---------
 YC  | VidarDB
(1 row)

UPDATE test SET value='VidarSQL';  
SELECT * FROM test;  
 key |  value   
-----+----------
 YC  | VidarSQL
(1 row)

DROP FOREIGN TABLE test;  
